Date,Season,Details
6/3/2005,2004-2005,"The NBA fined Denver $200,000 and suspended head coach George Karl for the first 3 games of 2005-06 for violating the rules prohibiting contact between NBA teams and players not yet eligible for the NBA draft. Karl attended workouts at Marquette University that included his son, Coby."
6/3/2005,2004-2005,"The NBA fined Rasheed Wallace (Det) $20,000 for public criticism of the refs after Tuesday's Det-Mia game and using inappropriate language when speaking to the media."
8/30/2005,2005-2006,"The NBA fined Minnesota $200,000 for holding a voluntary 2 day mini-camp last week."
10/25/2005,2005-2006,"The NBA reduced George Karl's 3 game suspension to 2 games, thus he will miss the first 2 games of the regular season. The suspension occured as a result of Karl attending workouts at Marquette University in May that included his son - the league has rules against contact between NBA teams and players not yet eligible for the NBA draft."
10/27/2005,2005-2006,The NBA suspended Robert Whaley (Uta) for 2 games for throwing a punch at Adam Prada (LAL) during Tuesday's Uta-LAL games.
11/11/2005,2005-2006,"The NBA fined Mike Montgomery (GS) $25,000 and Jason Richardson (GS) $20,000 for failing to leave the court in a timely manner and verbally abusing the refs following Wednesday's GS-Chi game. 11/9/05"
11/14/2005,2005-2006,"The NBA fined Sacramento $30,000 for showing a derogatory video of Detroit on the jumbotron while the Pistons were introduced during the November 8 Det-Sac game."
11/30/2005,2005-2006,The NBA suspended George Karl (Den) for 2 games for criticizing the refs following Monday's Den-NJ game.
12/1/2005,2005-2006,Denver suspended Voshon Lenard for 1 game for conduct detrimental to the team.
12/4/2005,2005-2006,"The NBA fined Doc Rivers (Bos) $10,000 for failing to leave the court in a timely manner following his ejection from Friday's Bos-Chi game."
12/6/2005,2005-2006,"The NBA has fined 13 players $10,000 for wearing their shorts too long. The league has a rule requiring shorts to be at least 1 inch above the knee. The fined players are Nate Robinson (NY), Stephon Marbury (NY), John Salmons (Phi), Kyle Korver (Phi), Allen Iverson (Phi), Kevin Ollie (Phi), Jermaine O'Neal (Ind), Stephen Jackson (Ind), Jamaal Tinsley (Ind), Jeff McInnis (NJ), Voshon Lenard (Den), DerMarr Johnson (Den), and Andre Miller (Den). The Players Association is appealing the fines. In addition, the player's team was fined $50,000 for each violation."
12/6/2005,2005-2006,The NBA suspended Josh Smith (Atl) for 2 games for elbowing Raja Bell (Pho) during Sunday's Atl-Pho game.
12/6/2005,2005-2006,"The NBA fined Carmelo Anthony (Den) $5,000 for tossing a ball into the stands during Saturday's Mia-Den game."
12/10/2005,2005-2006,The NBA suspended Danny Fortson (Sea) for 1 game for verbally abusing the refs and failing to leave the court in a timely manner following his ejection during Friday's Sea-Uta game
12/12/2005,2005-2006,"The NBA fined Houston $100,000 for taking the team to Las Vegas during last week's road trip."
12/15/2005,2005-2006,"The NBA fined Phil Jackson (LAL) $25,000 for violating the league's anti-tampering rule for Jackson's comments about the Lakers' future interest in Chris Bosh (Tor)."
12/15/2005,2005-2006,"The NBA fined Ron Artest (Ind) $10,000 for making public statements detrimental to the NBA for his public statement that he wanted to be traded."
12/18/2005,2005-2006,"Dallas fined Darrell Armstrong (a long time Washington fan) $1,000 for his comment of ""How about them Redskins"" on the mic after wishing the fans a safe holiday prior to Sunday's Dal-Orl game. Washington defeated the Cowboys 35-7 earlier that day. Dallas planned on donating the fine to a charity of the Cowboy's choice."
12/19/2005,2005-2006,Utah fined Deron Williams and Robert Whaley an undisclosed amount for lying to the team regarding their involvement in an altercation in which they gave the police a false name. Whaley was also suspended for 1 game for lying to the team about how he suffered a cut on his right hand that required 6 stitches.
12/26/2005,2005-2006,"The NBA fined Stephen Jackson (Ind) $20,000 for making an obscene gesture after he was ejected during Friday's Cle-Ind game. Jackson denies making the gesture and plans on appealing the fine."
12/26/2005,2005-2006,"The NBA fined Nate McMillan (Por) $15,000 for verbally abusing the refs and failing to leave the court in a timely manner following Friday's Min-Por game."
12/29/2005,2005-2006,The NBA suspended Danny Fortson (Sea) for 2 games for berating a ref and failing to leave the court in a timely manner following his ejected during Wednesday's Sea-Min game.
12/30/2005,2005-2006,The NBA suspended Kobe Bryant (LAL) for 2 games for his flagrant elbow to Mike Miller (Mem) in the throat during Wednesday's Mem-LAL game. Bryant also commented after the game that he planned on fouling hard the next player who came down the lane when he fouled Miller.
1/2/2006,2005-2006,New York activated Jackie Butler and placed Jerome James on IL. James was suspended indefinitely for conduct detrimental to the team as the Knicks said he was unprepared to practice on Sunday.
1/7/2006,2005-2006,The NBA suspended Juwan Howard (Hou) for 1 game for shoving the ball into the face of Mike James (Tor) during Friday's Hou-Tor game.
1/11/2006,2005-2006,The NBA suspended Carlos Arroyo (Det) for bumping a ref during Tuesday's Det-NO game.
1/12/2006,2005-2006,Orlando suspended Steve Francis indefinitely for conduct detrimental to the team. Francis refused to re-enter Wednesday's Orl-Sea game during the 4th quarter. Francis ended up being suspended for 2 games.
1/13/2006,2005-2006,"The NBA suspended Keyon Dooling (Orl) for 5 games and Ray Allen (Sea) for 3 games for their fight in Wednesday's Orl-Sea game. Dooling got the longer suspension as he initiated the fight and also attempted to confront Allen in the hallway after leaving the court (security was able to keep Dooling from reaching Allen, though words were exchanged)."
1/19/2006,2005-2006,The NBA suspended Antonio Davis (NY) for 5 games for going into the stands during Wednesday's NY-Chi game. Davis thought his wife was in danger and returned to the court (and was then ejected) without incident.
1/19/2006,2005-2006,The NBA suspended Baron Davis (GS) for 1 game for hitting Luke Ridnour (Sea) in the chest during Monday's GS-Sea game.
1/19/2006,2005-2006,"The NBA fined John Paxson (Chi GM) $15,000 for verbally abusing the refs following Monday's Chi-Den game."
1/26/2006,2005-2006,Utah suspended indefinitely Greg Ostertag for his conduct after Thursday's Uta-Sea game. Ostertag reportedly got in a verbal argument with coach Jerry Sloan. Ostertag's suspension ended up being for 1 game.
1/27/2006,2005-2006,"The NBA dismissed Chris Andersen (NO) from the league for violating the league's substance abuse program. As he had not been suspended previously for performance enhancing drugs (ie, steroids), he was mostly likely tossed for a positive test for ""drugs of abuse"", which could be any of methamphetamine, cocaine, LSD, opiates (including heroin, codeine, morphine), and PCP. The NBA Players Association will automatically appeal the dismissal. If the dismissal is upheld, Andersen can not apply for reinstatement for 2 years."
2/2/2006,2005-2006,"The NBA fined Larry Brown (NY) $20,000 for failing to leave the court in a timely manner following his ejection during Tuesday's NY-LAL game."
2/13/2006,2005-2006,"The NBA fined Kenyon Martin (Den) $15,000 for using inappropriate language with fans following Wednesday's Chi-Den game."
2/24/2006,2005-2006,The NBA suspended Sebastian Telfair (Por) for 2 games for violating the league's anti-gun rules. Telfair had accidentally carried a gun on to a team flight during a recent road trip.
2/24/2006,2005-2006,The NBA suspended David Harrison (Ind) for 1 game for directing obscenities at fans during Thursday's Ind-Det game.
2/24/2006,2005-2006,Atlanta suspended Salim Stoudamire for 2 games for conduct detrimental to the team.
2/27/2006,2005-2006,"The NBA fined Kevin Garnett (Min) $5,000 for throwing the ball into the stands during Sunday's Min-Mem game."
2/27/2006,2005-2006,"The NBA fined Ricky Davis (Min) $5,000 for kicking the ball into the stands during Friday's Den-Min game."
2/27/2006,2005-2006,"The NBA fined Rasheed Wallace (Det) $5,000 for throwing an elbow at Zydrunas Ilgauskas during Monday's Det-Cle game."
3/3/2006,2005-2006,The NBA suspended Robert Horry (SA) for 2 games for his altercation with Jerry Stackhouse and for making contact with a ref during Thursday's Dal-SA game.
3/3/2006,2005-2006,"The NBA fined Jerry Stackhouse (Dal) $30,000 for his comments about a ref following Thursday's Dal-SA game."
3/8/2006,2005-2006,"The NBA fined Brian Hill (Orl) $25,000 for criticizing the refs following Monday's Uta-Orl game."
3/17/2006,2005-2006,"The NBA fined Mike Woodson (Atl) $20,000 and Josh Smith (Atl) $15,000 for comments they made regarding the refs following Monday's Atl-Mil game."
3/19/2006,2005-2006,"The NBA fined Richard Hamilton (Det) $5,000 for throwing the ball into the stands during Friday's NY-Det game."
3/27/2006,2005-2006,"The NBA fined Bonzi Wells (Sac) $5,000 for punching the ball into the tunnel during Sunday's Sac-GS game."
3/28/2006,2005-2006,"The NBA fined Bruce Bowen (SA) $10,000 for kicking Ray Allen (Sea) in the back during Sunday's SA-Sea game."
3/28/2006,2005-2006,"The NBA fined Udonis Haslem (Mia) $5,000 for removing his jersey before he left the court after his ejection in Monday's Mia-Ind game."
3/29/2006,2005-2006,Boston suspended Orien Greene indefinitely for conduct detrimental to the team following his arrest for speeding over 90 mph on a city street.
3/31/2006,2005-2006,The NBA suspended DJ Mbenga (Dal) for 1 game for his flagrant foul on LeBron James (Cle) during Wednesday's Dal-Cle game.
4/5/2006,2005-2006,"The NBA fined Carmelo Anthony (Den) $15,000 for throwing the ball into the stands during Tuesday's Den-LAC game."
4/6/2006,2005-2006,The NBA suspended Rashard Lewis (Sea) for 1 game for his recent guilty plea for reckless driving.
4/7/2006,2005-2006,"The NBA fined Shaquille O'Neal (Mia) $15,000 for criticizing the refs and Stu Jackson, who is in charge of the officials, following Sunday's NJ-Mia game."
4/11/2006,2005-2006,"The NBA fined Richard Jefferson (NJ) $5,000 for kicking the ball into the standings during Sunday's NJ-Mil games."
4/14/2006,2005-2006,"The NBA suspended Josh Childress (Atl) for 2 games for throwing a forearm at Andres Nocioni (Chi) and fined Nocioni $5,000 and assessed him a flagrant foul level 2 for making unnecessary and excessive contact with Childress during Wednesday's Atl-Chi game."
4/14/2006,2005-2006,"The NBA fined Erick Dampier (Dal) $5,000 and upgraded his flagrant foul level 1 to a level 2 for his foul on Shawn Marion (Pho) during Thursday's Dal-Pho game."
4/17/2006,2005-2006,Portland suspended Zach Randolph for 1 game for leaving the arena during a game.
4/24/2006,2005-2006,The NBA suspended Ron Artest (Sac) for 1 game for throwing an elbow at Manu Ginobili (SA) during Saturday's Sac-SA game.
4/24/2006,2005-2006,The NBA suspended Udonis Haslem (Mia) for 1 game for throwing his mouth piece towards a ref during Saturday's Chi-Mia game.
4/25/2006,2005-2006,Denver suspended Kenyon Martin indefinitely for refusing to enter the game in the 2nd half of Monday's Den-LAC game.
4/27/2006,2005-2006,"The NBA fined Jermaine O'Neal (Ind) $15,000 for publicly criticizing the refs following Tuesday's Ind-NJ game."
4/29/2006,2005-2006,"The NBA fined Shaquille O'Neal (Mia) $25,000 for criticizing the refs after Thursday's Mia-Chi game."
5/1/2006,2005-2006,"The NBA fined Reggie Evans (Den) $10,000 and assessed him a flagrant foul level 2 for grabbing Chris Kaman (LAC) below the belt during Saturday's Den-LAC game. Kaman was assessed a flagrant for shoving Evans after the incident, but that has been downgraded to a technical."
5/1/2006,2005-2006,"The NBA fined Richard Hamilton (Det) $15,000 for his flagrant foul on Michael Redd (Mil) during Saturday's Det-Mil game."
5/3/2006,2005-2006,The NBA suspended Raja Bell (Pho) for 1 game for throwing Kobe Bryant (LAL) to the ground during Tuesday's Pho-LAL game.
5/3/2006,2005-2006,"The NBA fined Dirk Nowitzki (Dal) $15,000 and assessed him a flagrant foul level 2 for throwing an elbow at the chest of Pau Gasol (Mem) during Monday's Dal-Mem game."
5/10/2006,2005-2006,"The NBA fined Mark Cuban (Dal owner) $100,000 for going on the court during Sunday's SA-Dal game to complain about a non-call and $100,000 for criticizing on his blog how the league selects the playoffs refs."
5/12/2006,2005-2006,The NBA suspended Clifford Robinson (NJ) for 5 games for violating the league's substance abuse policy [most likely marijuana].
5/18/2006,2005-2006,The NBA suspended Jason Terry (Dal) for 1 game for throwing a punch at Michael Finley (SA) during Wednesday's Dal-SA game.
5/24/2006,2005-2006,"The NBA fined Eddie Jordan (Was) $25,000 for criticizing the refs following Cle-Was game 3 on April 28 (the fine was not previously announced by the league)."
6/11/2006,2005-2006,"The NBA fined Shaquille O'Neal (Mia) $10,000 and Miami $25,000 for O'Neal failing to make himself available to the media following Sunday's Dal-Mia game."
10/13/2006,2006-2007,"The NBA suspended Lorenzen Wright (Atl) and Kimani Ffriend (Mem) for 1 game for throwing punches in Wednesday's Atl-Mem game. Wright will serve the suspension in the first regular season game. Ffriend, released by Memphis, will serve the suspension in his next regular season game with an NBA team."
10/27/2006,2006-2007,The NBA suspended Danny Fortson (Sea) for 1 game for his flagrant foul on Ron Artest (Sac) during Wednesday's Sea-Sac game.
11/4/2006,2006-2007,"The NBA fined Robert Sarver (Pho owner) $25,000 for excessive complaining about the officiating during Wednesday's Pho-LAC game."
11/4/2006,2006-2007,"The NBA fined Josh Howard (Dal) $5,000 and upgraded his flagrant foul to a level 2 for his flagrant foul on Bruce Bowen (SA) during Thursday's Dal-SA game."
11/10/2006,2006-2007,The NBA suspended John-Blair Bickerstaff (Cha assistant) for 2 games for his DWI conviction.
11/14/2006,2006-2007,"The NBA fined Brevin Knight (Cha) $10,000 for failing to leave the court in a timely manner after his ejection during Friday's Cha-Sea game."
11/17/2006,2006-2007,"The NBA fined Jeff Van Gundy (Hou coach) $25,000 for publicly criticizing the refs. His complaints about the refs' treatment of Yao Ming during Sunday's Hou-Mia game appeared in a Houston Chronicle article on Wednesday."
11/27/2006,2006-2007,"The NBA fined Bobby Jackson (Mem) $20,000 for verbal abuse and failing to leave the court in a timely manner following his ejection during Saturday's Mem-Dal game."
11/29/2006,2006-2007,"The NBA fined Phil Jackson (LAL) $25,000 for criticizing the refs following Friday's LAL-Uta game."
12/6/2006,2006-2007,The NBA suspended Maurice Taylor (Sac) for 5 games for violating the league anti-drug program.
12/6/2006,2006-2007,The NBA suspended Zaza Pachulia (Atl) for 1 game for elbowing Johan Petro (Sea) during Tuesday's Atl-Sea game.
12/9/2006,2006-2007,Portland suspended Zach Randolph for making an obscene gesture toward the fans at the end of Friday's Por-Ind game.
12/11/2006,2006-2007,"Indiana suspended Stephen Jackson for 1 game for conduct detrimental to the team. Jackson got in an argument with coach Rick Carlisle during Monday's Ind-Chi game, after which Carlisle kicked Jackson off the bench."
12/18/2006,2006-2007,"The NBA handed down the suspensions for Saturday's Denver-New York fight and, as expected, the penalties were harsh. Carmelo Anthony (Den) was suspended for 15 games (throwing a punch at Collins). J.R. Smith (Den) and Nate Robinson (NY) were suspended for 10 games each (their scuffle ended up in the front row of fans). Mardy Collins (NY) was suspended for 6 games (his the flagrant foul started the whole thing). Jared Jeffries (NY) was suspended for 4 games (he aggressively tried to get at Anthony). Nene (Den) and Jerome James (NY) were suspended for 1 game each for leaving the bench during the incident (automatic suspensions, they did not participate in any altercations). In addition, the league fined the 2 teams $500,000 each."
12/27/2006,2006-2007,"The NBA fined Jason Kidd (NJ) $20,000 for criticizing the refs following Tuesday's Det-NJ game."
12/29/2006,2006-2007,The NBA suspended James Posey (Mia) for 1 game for his flagrant foul on Luol Deng (Chi) during Wednesday's Mia-Chi game.
1/5/2007,2006-2007,The NBA suspended Raja Bell (Pho) for 1 game for kicking Andrea Bargnani (Tor) during Wednesday's Pho-Tor game.
1/5/2007,2006-2007,"The NBA fined Allen Iverson (Den) $25,000 for his comments about the refs following Tuesday's Den-Phi game."
1/12/2007,2006-2007,The NBA suspended Eddie Griffin (Min) for 5 games for violating the league's anti-drug program.
1/12/2007,2006-2007,The NBA suspended ref Rodney Mott for 3 games for making an obscene gesture at a fan and using inappropriate language after Sunday's Mia-Por game.
1/13/2007,2006-2007,The NBA suspended Andres Nocioni (Chi) for 1 game for elbowing Mikki Moore (NJ) during Thursday's Chi-NJ game.
1/15/2007,2006-2007,Chicago suspended Chris Duhon for 1 game for missing Sunday's practice.
1/17/2007,2006-2007,"The NBA fined Eddie Jordan (Was) $15,000 for failing to leave the court in a timely manner following his ejection from Saturday's Was-SA game."
1/20/2007,2006-2007,The NBA suspended Baron Davis (GS) for 1 game for throwing a punch at Quinton Ross (LAC) during Wednesday's GS-LAC game.
1/20/2007,2006-2007,Minnesota suspended Ricky Davis for 1 game for leaving the bench for the locker room during Friday's Min-Det game.
1/22/2007,2006-2007,"The NBA fined Josh Smith (Atl) $25,000 for giving the finger to the crowd following his ejection in Saturday's Atl-Cha game."
1/30/2007,2006-2007,The NBA suspended Kobe Bryant (LAL) for 1 game for throwing an elbow at Manu Ginobili (SA) during Sunday's LAL-SA game.
1/31/2007,2006-2007,The NBA suspended Eric Musselman for 2 games for his recent conviction of DWI.
2/5/2007,2006-2007,The NBA suspended Gary Payton (Mia) for 1 game for verbally anbusing the ref following his ejecction in Saturday's Mia-Mil game.
2/6/2007,2006-2007,"Chicago fined Tyrus Thomas (Chi) $10,000 for making comments to the media that he was only interested in the money for the Slam Dunk contest."
2/9/2007,2006-2007,Washington suspended Etan Thomas for 2 games for his fight in practice with Brendan Haywood.
2/10/2007,2006-2007,The NBA suspended Darrell Armstrong (Ind) for 1 game for verbally abusing the ref following his ejection during Friday's Ind-Den game.
3/1/2007,2006-2007,"The LA Lakers fined Vladimir Radmanovic $500,000 for violating his contract by snowboarding. Radmanovic suffered a separated shoulder while snowboarding during the All-Star break."
3/7/2007,2006-2007,"The NBA suspended Lindsey Hunter (Det) for 10 games for violating the NBA's anti-drug policy. Hunter tested positive for phenermine, a banned substance used for weight loss."
3/7/2007,2006-2007,The NBA suspended Kobe Bryant (LAL) for 1 game for striking Marko Jaric (Min) in the face during Tuesday's Min-LAL game.
3/10/2007,2006-2007,The NBA suspended Rasheed Wallace (Det) for 1 game for receiving his 16th technical foul of the season (an automatic suspension).
3/10/2007,2006-2007,Indiana suspended Jamaal Tinsley for 1 game for conduct detrimental to the team.
3/13/2007,2006-2007,"The NBA fined Brevin Knight (Cha) $25,000 for failing to leave the court in a timely manner and verbally abusing the ref following his ejection in Saturday's Cha-Mem games."
3/14/2007,2006-2007,"The NBA fined Andrew Bogut (Mil) $25,000 for making an obscene gesture towards the fans during Monday's Mil-Tor game."
3/15/2007,2006-2007,"The NBA fined Phil Jackson and the LA Lakers $50,000 each for Jackson's comments that the league was on a witch hunt against Kobe Bryant."
3/18/2007,2006-2007,"The NBA fined Boston $30,000 for excessive contact with the family of underclassman Kevin Durant."
3/18/2007,2006-2007,"The NBA fined Charlotte $15,000 for public comments minority owner Michael Jordan made regarding underclassman Kevin Durant."
3/18/2007,2006-2007,"The NBA fined Golden State $15,000 for public comments coach Don Nelson made regarding underclassmen Greg Oden and Kevin Durant."
3/24/2007,2006-2007,"The NBA suspended Rasheed Wallace (Det) for 1 game for receiving his 18th technical foul, an automatic suspension."
4/3/2007,2006-2007,"The NBA fined Isiah Thomas (NY) $50,000 for comments he made about the officiating following Saturday's NY-NO game."
4/9/2007,2006-2007,Atlanta suspended Josh Smith for 2 games for conduct detrimental to the team. Smith shouted at coach Mike Woodson during Sunday's Phi-Atl game.
4/10/2007,2006-2007,"The NBA fined Adam Morrison (Cha) $25,000 for flipping off a fan during Sunday's Mia-Cha game."
4/17/2007,2006-2007,"The NBA suspended ref Joey Crawford indefinitely, including for the rest of the 06-07 regular season and playoffs, for improper conduct and a lack of professionalism and for being a repeat offender. Crawford ejected Tim Duncan (SA) from Sunday's Dal-SA game for simply laughing while he was on the bench."
4/17/2007,2006-2007,"The NBA fined Tim Duncan (SA) $25,000 for inappropriate comments made to Crawford following his ejection during Sunday's Dal-SA game."
4/23/2007,2006-2007,"The NBA fined Kirk Hinrich (Chi) $25,000 for throwing his mouth piece during Saturday's Mia-Chi game."
4/27/2007,2006-2007,"The NBA fined Stephen Jackson (GS) $50,000 for failing to leave the court in a timely manner and verbal abuse of the refs following his ejection in Wednesday's Dal-GS game."
5/3/2007,2006-2007,"The NBA fined Jason Richardson (GS) $35,000 for improper contact with a fan during Tuesday's Dal-GS game."
5/15/2007,2006-2007,The NBA suspended Robert Horry (SA) for 2 games for his forearm shiver on Steve Nash (Pho) late in Monday's SA-Pho game and for striking Raja Bell (Pho) during the confrontation after the incident. Amare Stoudemire (Pho) and Boris Diaw (Pho) were suspended for leaving the bench during the altercation.
5/22/2007,2006-2007,"The NBA fined San Antonio $50,000 for failing to make their players available to the media on Monday. San Antonio had given the players the day off."
7/14/2007,2008-2009,The NBA suspended Ron Artest (Sac) for 7 games for his no contest plea in May to a misdemeanor domestic violence charge.
7/14/2007,2008-2009,The NBA suspended Stephen Jackson (GS) for 7 games for his guilty plea in June to a felony count of criminal recklessness for firing a gun outside a strip club last fall.
8/23/2007,2008-2009,"The NBA fined Seattle co-owner Aubrey McClendon $250,000 for his comments from 2 weeks ago about the new owners' plans to move the team to Oklahoma."
8/31/2007,2008-2009,The NBA suspended James Posey (Bos) for 1 game for his no contest plea regarding a charge of reckless driving.
9/17/2007,2008-2009,The NBA reinstated suspended referee Joey Crawford. Crawford had been suspended since 4/17/07 for improper conduct and a lack of professionalism and for being a repeat offender following a Dallas-San Antonio game where Crawford ejected Tim Duncan (SA) for simply laughing while Duncan was on the bench.
10/19/2007,2008-2009,The NBA suspended Josh Howard (Dal) for 2 games for throwing a forearm at the back of Brad Miller (Sac) after Miller intentionally shoved Devin Harris (Dal) to the ground during Tuesday's Dal-Sac game.
10/20/2007,2008-2009,Denver suspended J.R. Smith for the first 3 games of the regular season for conduct detrimental to the team.
10/31/2007,2008-2009,"The NBA suspended Lakers owner Jerry Buss for 2 games and fined him $25,000 for his conviction on a misdemeanor drunk driving charge in May."
11/14/2007,2008-2009,"New York fined Stephon Marbury one game's pay (about $182,000) for missing Tuesday's NY-Pho game."
11/26/2007,2008-2009,"The NBA fined Avery Johnson (Dal) $25,000 for failing to leave the court in a timely manner following his ejection in Friday's Dal-Ind game."
12/13/2007,2008-2009,The NBA suspended Al Horford (Atl) for 1 game for his flagrant foul on T.J. Ford (Tor) during Tuesday's Tor-Atl game.
12/14/2007,2008-2009,"The NBA suspended Tyrus Thomas (Chi) for 1 game and fined Troy Murphy (Ind) $10,000 for their fight during Wednesday's Chi-Ind game."
12/15/2007,2008-2009,The NBA suspended Kenyon Martin (Den) for 1 game for his flagrant foul on Melvin Ely (NO) during Wednesday's Den-NO game. Martin's elbow hit Ely in the face and resulted in Ely suffering a fractured left eye socket.
1/1/2008,2008-2009,The NBA suspended Lamar Odom (LAL) for 1 game for his flagrant foul on Ray Allen (Bos) during Sunday's LAL-Bos game.
1/4/2008,2008-2009,The NBA suspended Zach Randolph (NY) for 1 game for throwing his headband at a ref during Wednesday's NY-Sac game.
1/11/2008,2008-2009,"In a rarity, the NBA upheld Miami's protest of the December 19 game at Atlanta. Atlanta led 114-111 with 51.9 seconds left in overtime when the scoring table ruled that Shaquille O'Neal (MIA) had collected his 6th foul and, thus, was disqualified when it was actually only O'Neal's 5th foul. Atlanta went on to win the game 117-111. That game is now invalid (with Atlanta losing a win and Miami losing a loss in the current standings) and the game will be replayed starting with 51.9 seconds left and the score 114-111 Atlanta on March 8 prior to the scheduled Miami at Atlanta game (the replay game will occur and then the teams will play a full game). The Hawks were also fined $50,000 for the mistake. It was the first time since December 1982 that the NBA upheld a protest."
1/11/2008,2008-2009,The NBA suspended David Harrison (Ind) for 5 games for violating the league's anti-drug program.
